company,model,application,payload_kg,reach_mm,axes,repeatability,price_inr,notes,image_file
OTC,FD-V166 / FD-V166H,,166,2654,6,±0.1 mm,₹1.2 – ₹2.5 Crore,Heavy payload arm for large fixtures — can be repurposed for heavy tools or multi-gun arrays (industry series).,OTC_FD-V166___FD-V166H.jpeg
OTC,FD19-V210 / V210A,,210,2674,6,±0.15 mm,₹1.3 – ₹2.8 Crore,Very high payload for structural parts; possible use in very large coating or material handling paint cells.,OTC_FD19-V210___V210A.png
Durr,EcoRP 10 R1100,,10,1100,6,±0.10–0.20 mm,₹35 – 65 Lakh,Compact ready-to-spray painting robot for general industry & small parts; supports 1K/2K and high/low pressure paint processes; explosion-proof design possible.,Durr_EcoRP_10_R1100.jpeg
Durr,EcoRP E/L033i,,10–15 est.,1300–1500+ est.,6,±0.10–0.20 mm,₹90 Lakh – 1.5 Crore,Modular 6-axis robot for automotive exterior/interior paint with or without rail; can also be used for hood/door opening tasks,Durr_EcoRP_E_L033i.jpeg
Durr,EcoRP E/L133i,,10–15 est.,1300–2000+ est.,6,±0.10–0.20 mm,₹90 Lakh – 1.6 Crore,Similar to E/L033i but usually mounted on EcoRail X (rail) for line tracking painting; flexible mounting,Durr_EcoRP_E_L133i.jpeg
Durr,EcoRP E043i,,10–15 est.,1800–2500+ est.,6,±0.10–0.20 mm,₹1.2 Lakh – 2.5 Crore,"Advanced 7-axis robot (no rail needed in many cases), larger work envelope, better access to interior body areas (reduces booth size & rail costs).",Durr_EcoRP_E043i.jpeg
Durr,EcoRP S053i,,15–25+ est.,5000,6,±0.15–0.25 mm,₹2.0 Lakh – 3.5 Crore,Swing-arm robot for commercial vehicle exterior & interior painting; long reach for large body loading areas.,Durr_EcoRP_S053i.jpeg
Durr,EcoRP S153i,,15–25+ est.,5000+,6,±0.15–0.25 mm,₹2.0 Lakh  – 3.5 Crore,Heavy-duty swing arm robot for large commercial vehicles & industrial parts coatings.,Durr_EcoRP_S153i.jpeg
